<xs:schema attributeFormDefault="unqualified" elementFormDefault="qualified" xmlns:xs="http://www.w3.org/2001/XMLSchema">
  <xs:element name="contracts">
    <xs:complexType>
      <xs:sequence>
        <xs:element name="contract" minOccurs="0" maxOccurs="unbounded">
          <xs:complexType>
            <xs:sequence>
              <xs:element type="xs:string" name="BSN"/>
              <xs:element type="xs:string" name="clientName"/>
              <xs:element type="xs:decimal" name="ownRisk"/>
              <xs:element type="xs:integer" name="insuranceID"/>
              <xs:element type="xs:date" name="startDate"/>
              <xs:element type="xs:date" name="endDate"/>
            </xs:sequence>
          </xs:complexType>
        </xs:element>
      </xs:sequence>
    </xs:complexType>
  </xs:element>
</xs:schema>