<?xml version="1.0" encoding="UTF-8"?>

<contracts
    xmlns:xsi='http://www.w3.org/2001/XMLSchema-instance'
    xsi:noNamespaceSchemaLocation='InsuranceContracts.xsd'>
    <contract>
        <clientName>Burak</clientName>
        <ownRisk>200</ownRisk>
        <insuranceID>001</insuranceID>
        <startDate>2015-10-10</startDate>
        <endDate>2016-12-10</endDate>
    </contract>    

    <contract>
        <clientName>Rico</clientName>
        <ownRisk>150</ownRisk>
        <insuranceID>002</insuranceID>
        <startDate>2015-09-15</startDate>
        <endDate>2016-11-18</endDate>
    </contract> 
    
    <contract>
        <clientName>Bart</clientName>
        <ownRisk>50</ownRisk>
        <insuranceID>003</insuranceID>
        <startDate>2015-08-05</startDate>
        <endDate>2016-12-28</endDate>
    </contract>           
</contracts>
